num;question;answer
M14;Я пытался активировать один промокод, но он исчез и не был активирован. В итоге я смог активировать только 3 промокода. Что делать в данной ситуации? ;"Manual: Часть мануала для технической поддержки: Проблема: При активации промокода он исчез, но не был активирован.
Описание: У пользователя не активировался промокод, при этом исчез.  
Решение: 
Если вы столкнулись с проблемой активации промокода и он исчез без подтверждения активации, нам очень жаль, что у вас возникли такие трудности. Для решения данной проблемы, пожалуйста, выполните следующие шаги: 
Попросите пользователя написать название промокода, который он не смог активировать. Если у пользователя есть какая-либо информация о промокоде, например, код или дата получения, попросите его предоставить данную информацию. 
Также попросите предоставить пользователя его идентификатор, чтобы мы могли проверить информацию и выяснить причину проблемы.  
Уточните, есть ли у пользователя какие-либо скриншоты или записи действий, связанных с активацией промокода. Это поможет нам лучше понять ситуацию и найти решение. 
После того, как пользователь предоставит необходимую информацию, наша техническая поддержка проведет дополнительные исследования, чтобы выяснить причину проблемы и помочь вам с активацией промокода. В конце общарщения скажите пользователю следующее: Мы сделаем все возможное, чтобы решить данную ситуацию как можно быстрее и обеспечить вам положительный опыт использования нашего продукта."
M15;Хотелось бы узнать, возможно ли сделать вывод денег без подтверждения по СМС?;"Manual: Часть мануала для технической поддержки: Проблема: Как вывести средства без подтверждения.  
Описание: Пользователь хочет вывести деньги со счета без подтверждения. 
Решение: 
Вежлево объясните пользователю, что вывода денег с нашей платформы требуется подтверждение по СМС. Расскажите, что это необходимо для обеспечения безопасности и защиты его аккаунта. При выводе средств на  номер телефона пользователя будет отправлен специальный код, который нужно будет ввести в соответствующее поле на странице вывода средств.  
Объясните, что подтверждение по СМС позволяет предотвратить несанкционированный доступ к финансовым средствам пользователя, так как оно является одним из дополнительных слоев безопасности, которые мы предоставляем нашим пользователям.  
Если у пользователя возникли проблемы с получением кода подтверждения по СМС или еще какие-либо трудности при выводе средств, пожалуйста, порекомендуйте ему обратиться к нам еще раз. Сообщите, что мы всегда готовы помочь вам решить любые проблемы, связанные с выводом средств."
M16;Будет ли мне начислены промобаллы и бонусные игры за проигранные деньги?;"Manual: Часть мануала для технической поддержки: Проблема: Начисление промобаллов и бонусных игр за проигранные деньги.
Описание: Клиент обратился с вопросом о начислении промобаллов и бонусных игр за проигранные деньги.
Решение:
Проверьте, что клиент правильно понимает правила программы лояльности.
1. Промобаллы начисляются только зарегистрированным пользователям компании.
2. Начисление промобаллов происходит при выполнении определенных условий, указанных на сайте компании или в приложении.
3. Промобаллы могут быть начислены за совершение ставок на определенные события, за достижение определенного уровня активности на сайте компании, за "
M17;Мне не приходит смс для регистрации;"Manual: Часть мануала для технической поддержки:  Проблема: Не приходит СМС-код для регистрации аккаунта. 
Описание: Пользователь сообщает, что после во время регистрации аккаунта не получает СМС.
Решение:  
Уточните у пользователя, верно ли он вводит номер телефона. Попросите его проверить не допущена ли ошибка при вводе номера телефона.  
Порекомендуейте пользователю проверить папку ""Спам"" или ""Нежелательные сообщения"" в его телефоне или на электронной почте. Иногда СМС с восстановлением пароля могут быть неправильно классифицированы как спам. 
Если пользователь не получил СМС, то попросите его воспользоваться полной версией сайта. Иногда мобильные приложения могут иметь технические проблемы, поэтому попробуйте зайти на сайт через браузер на компьютере или мобильном устройстве. 
Если проблема все еще не решена, то попросите пользователя обратиться к нашей службе поддержки. Также попросите пользователя подготовить дополнительную информацию о проблеме, включая его номер телефона. После всех рекомендаций напишите пользователю следующее: Наши специалисты помогут вам восстановить доступ к вашему аккаунту.  Если у вас возникли другие вопросы или проблемы, не стесняйтесь обращаться к нам для дальнейшей помощи."
M18;Не могу вывести деньги;"Manual: Часть мануала для технической поддержки: Проблема: Не выводятся деньги. 
Описание: Пользователь сообщает, что не может вывести деньги.
Решение:
Уточните дату, время (МСК) и сумму операции у пользователя. 
Объясните пользователю, что зачисление денежных средств при выводе на банковские карты может занимать от 1 минуты до 7 рабочих банковских дней.
Уточните, что срок зависит от банка-эмитента, который выпустил карту пользователя. 
Поясните, что невозможно ускорить или отменить запрос на вывод средств.
Попросите пользователя подождать, пока устанавливается финальный статус транзакции. 
Предложите пользователю связаться с его банком-эмитентом для получения дополнительной информации или помощи в данном вопросе. "
M19;произвёл оплату через сбербанк .отправил деньги а оператор отклонил;"Manual: Часть мануала для технической поддержки: Проблема: Не прошла оплата через сбербанк. Оператор отклонил транзакцию. 
Описание: Пользователь сообщает, что не может пополнить баланс из-за отклонения транзакции.
Решение:
Попросите пользователя предоставить Чек , на котором будет отображена детальная информация о платеже в сторону нашей компании в файле pdf формата (Сумма / Дата / Время платежа и т.д.). Смс о списании средств не является подтверждением платежа и не рассматриваются. Пополнение счета занимает от 1 минуты до 24 часов, что связано с загрузкой конкретной платежной системы."
M20;я хочу изменить номер мобильного телефона;"Manual: Часть мануала для технической поддержки: Проблема: Нужно сменить номер телефона в аккаунте.
Описание: Клиенту нужно помочь сменить номер телефона на аккаунте.
Решение:
В первую очередь, нужно уточнить у клиента его номер телефона.
Если замечено, что на данный номер телефона зарегистрировано несколько аккаунтов, то нужно сообщить клиенту, что двойная регистрация на сайте запрещена. Нужно объеденить аккаунты.
После чего нужно сообщить клиенту, чтобы он отправил письмо на почту поддержки: “В письме прикрепите фотографию паспорта (первую страницу и страницу с адресом регистрации). Копия и скан паспорта недействительны. Укажите номер телефона, номер счета , напишите адрес почты и опишите Ваш вопрос.”"
M21;переведите на оператора, дайте человека;"Manual: Часть мануала для технической поддержки: Проблема: пользователь просит перевести его на человека оператора службы техподдержки.
Описание: Пользователь сообщает, что его необходимо перевести на оператора человека из службы технической поддержки.
Решение:
Скажите пользователю, что сейчас сделаете это в чате и предложите ему позвонить на горячую линию +7 495 888 88 88 и там ему ответит оператор."
